doc_id	run_tag	rank	question	rating	explanation
clueweb22-en0037-89-16256	Lateral-Reading-Rating-3	1	Is CBS News considered a reliable and credible news source?	4	Explanation: This question is effective and aligns well with lateral reading strategies. It prompts readers to investigate the credibility of CBS News, which involves examining the reputation, history, and reliability of the organization. This can be done by looking up information about CBS News on independent sources such as Wikipedia, media watchdog organizations, or other trusted entities. However, the question could be improved by encouraging readers to also consider the specific article's author and the evidence presented within the article itself. Therefore, while it is strong, it does not fully address all critical areas of lateral reading.
clueweb22-en0037-89-16256	Lateral-Reading-Rating-3	2	Who is Lucy Craft, and what is her expertise in reporting on nuclear issues?	5	Explanation: This question is highly effective for lateral reading as it directly prompts the reader to investigate the author, Lucy Craft, and her expertise in the specific subject matter of nuclear issues. It encourages readers to look beyond the article itself and seek information about the author's background, qualifications, and credibility. This aligns well with the principle of examining who is behind the information, which is a core aspect of lateral reading. By understanding the author's expertise, readers can better assess the reliability and trustworthiness of the content.
clueweb22-en0037-89-16256	Lateral-Reading-Rating-3	3	Did Japan officially announce plans to discharge treated radioactive water from Fukushima into the Pacific Ocean?	3 (Neutral)	Explanation: This question is somewhat useful for lateral reading as it prompts the reader to verify a specific claim made in the article. It encourages the reader to look for official announcements or statements from credible sources, such as the Japanese government or international regulatory bodies. However, it does not fully align with all lateral reading principles. It focuses on verifying a single fact rather than encouraging a broader evaluation of the source's credibility, the author's expertise, or the evidence presented. To improve the question, it could be expanded to include prompts for checking the credibility of the sources reporting the announcement and comparing information from multiple reliable sources.
clueweb22-en0037-89-16256	Lateral-Reading-Rating-3	4	What is the International Atomic Energy Agency's stance on Japan's plan to discharge Fukushima water?	4	Explanation: This question is effective and aligns well with lateral reading strategies. It prompts readers to seek out the stance of a reputable and authoritative organization (the International Atomic Energy Agency, or IAEA) on a specific issue. By doing so, it encourages readers to verify the claims made in the original article by consulting an external, reliable source. This approach helps in cross-referencing information and understanding the broader context. However, the question could be improved by also encouraging readers to check multiple sources or perspectives, not just the IAEA's stance. This would ensure a more comprehensive evaluation of the information.
clueweb22-en0037-89-16256	Lateral-Reading-Rating-3	5	What are the safety standards for discharging treated radioactive water into the ocean?	2	Explanation: This question is somewhat relevant to evaluating the trustworthiness of the information, as it encourages readers to seek out factual information about safety standards. However, it does not directly align with the core principles of lateral reading. It does not prompt readers to investigate the credibility of the source, the author, or the organization behind the information. It also does not encourage readers to compare perspectives from multiple sources or verify the evidence presented in the article. While it may lead to some useful background information, it lacks focus on the critical aspects of lateral reading, such as examining the credibility and bias of the source.
clueweb22-en0037-89-16256	Lateral-Reading-Rating-3	6	What are the potential environmental impacts of discharging treated radioactive water into the Pacific Ocean?	2	Explanation: While the question is relevant to understanding the content of the article, it does not align well with the principles of lateral reading. It focuses on the topic of the article rather than guiding the reader to evaluate the trustworthiness of the information. It does not prompt the reader to investigate the author, organization, or publisher behind the information, nor does it encourage scrutiny of the evidence or comparison with other sources. To improve, the question could be rephrased to encourage verification of the claims made in the article by consulting multiple reliable sources or examining the credibility of the author and publication.
clueweb22-en0037-89-16256	Lateral-Reading-Rating-3	7	What are the arguments and evidence presented by critics like Greenpeace against Japan's plan?	3 (Neutral)	Explanation: This question encourages readers to look at the arguments and evidence presented by critics, which is a good start for lateral reading. It prompts readers to consider external perspectives and evidence, which can help in assessing the trustworthiness of the information. However, it does not fully align with all lateral reading principles. It does not explicitly encourage readers to investigate the credibility of the critics (e.g., Greenpeace) or to compare these arguments with other sources. Additionally, it does not prompt readers to verify the facts or claims using reliable external sources. To be more effective, the question could be expanded to include prompts for checking the credibility of Greenpeace and comparing their arguments with other expert opinions.
clueweb22-en0037-89-16256	Lateral-Reading-Rating-3	8	How have neighboring countries like China and South Korea officially responded to Japan's plan?	4	Explanation: This question is effective and aligns well with lateral reading strategies. It prompts readers to seek out corroborating or contradicting information from other reliable sources, specifically focusing on the official responses from neighboring countries. By doing so, it encourages readers to compare perspectives across multiple sources, which is a key aspect of lateral reading. However, it does not directly address the need to investigate the credibility of the original source or the expertise of the author, which are also important components of lateral reading. Therefore, while strong, it does not fully encompass all critical areas of lateral reading principles.
clueweb22-en0037-89-16256	Lateral-Reading-Rating-3	9	What measures are in place to ensure independent monitoring of radiation levels in the discharged water?	3 (Neutral)	Explanation: This question is somewhat useful as it prompts readers to consider the evidence and measures in place for monitoring radiation levels, which is a critical aspect of evaluating the trustworthiness of the information. However, it does not fully align with lateral reading principles. It does not encourage readers to investigate who is behind the information, verify the facts using external sources, or compare perspectives from multiple sources. To improve the question, it could be expanded to include prompts for checking the credibility of the organizations responsible for the monitoring and seeking corroborating information from other reliable sources.
clueweb22-en0037-89-16256	Lateral-Reading-Rating-3	10	What alternative solutions have been proposed for dealing with the contaminated water at Fukushima?	2	Explanation: This question focuses on exploring alternative solutions to a specific issue (contaminated water at Fukushima) rather than evaluating the trustworthiness of the information presented in the article. While it may lead to discovering different perspectives or additional information, it does not directly encourage readers to investigate the credibility of the source, the evidence provided, or what other reliable sources say about the topic. It lacks alignment with core lateral reading principles such as verifying the author, organization, or publisher, and scrutinizing the evidence presented.
